{
  "schema": "ph-vessel-centerline-authoring-report.v1",
  "schemaVersion": "1",
  "task": "TASK-A08",
  "recordedAt": "2026-09-10",
  "coordinateSpace": {
    "kind": "source-image-stack",
    "patientSpaceClaim": false,
    "ctRegistrationEstablished": false
  },
  "structures": [
    {
      "draftLabel": "radial_artery",
      "anatomicalId": "structure.radial_artery.left",
      "feasibilityClassification": "not-established",
      "centerlineStatus": "blocked",
      "centerlineUri": null,
      "reason": "TASK-AS06 strengthened the same-subject evidence by extending the reviewed ulnar anchor through the proximal radius/ulna transition and testing eight anonymous arterial tracks, but zero met the fixed branch-topology promotion gate. Radial/brachial/bifurcation identity remains unresolved, so no radial centerline is fabricated."
    },
    {
      "draftLabel": "ulnar_artery",
      "anatomicalId": "structure.ulnar_artery.left",
      "feasibilityClassification": "continuous-candidate",
      "centerlineStatus": "generated",
      "centerlineUri": "drive://10DxqbYQbiNUV_JIvqpCxQxLLMwUmJxmQ#a08-ulnar-lumen-centered-source-stack-centerline-v0.json",
      "reason": "The bounded 106-frame source-stack continuous candidate from avf1646a.png through avf1681a.png was accepted unchanged by TASK-A06 human source-mask review. TASK-AS06 does not invalidate this representation; it strengthens proximal same-subject continuity evidence while still making no complete-vessel-extent, Patient Space, TASK-A12 anatomical-review, or medical-validation claim."
    },
    {
      "draftLabel": "superficial_target_vein",
      "anatomicalId": null,
      "feasibilityClassification": "not-established",
      "centerlineStatus": "blocked",
      "centerlineUri": null,
      "reason": "TASK-AS06 tested eight anonymous superficial tracks over a wider same-subject extent, but zero met the fixed continuity gate. No accepted target-vein mask or named cephalic/basilic identity exists, so no superficial target centerline is fabricated."
    }
  ],
  "claims": {
    "centerlinesCreated": true,
    "patientSpaceGeometry": false,
    "medicalValidation": false,
    "automaticPromotionAllowed": false
  }
}
